{
  "$schema": "https://json-schema.org/draft/2020-12/schema",
  "$id": "https://lnhgames.dev/lnh-prism/schemas/component-spec/1.0",
  "title": "LNH Prism Component Specification",
  "type": "object",
  "additionalProperties": false,
  "required": ["schemaVersion", "id", "version", "status", "style", "template", "layers", "states", "compatibility"],
  "properties": {
    "schemaVersion": { "const": "1.0" }, "id": { "$ref": "#/$defs/id" }, "version": { "$ref": "#/$defs/semver" }, "status": { "enum": ["draft", "reviewed", "approved", "deprecated"] },
    "style": { "type": "object", "additionalProperties": false, "required": ["id", "version"], "properties": { "id": { "$ref": "#/$defs/id" }, "version": { "$ref": "#/$defs/semver" } } },
    "template": { "type": "object", "additionalProperties": false, "required": ["id", "version"], "properties": { "id": { "$ref": "#/$defs/id" }, "version": { "$ref": "#/$defs/semver" } } },
    "layers": { "type": "array", "minItems": 1, "items": { "type": "object", "additionalProperties": false, "required": ["id", "kind", "enabled"], "properties": { "id": { "$ref": "#/$defs/id" }, "kind": { "enum": ["shadow", "border", "fill", "texture", "highlight", "decal", "content"] }, "enabled": { "type": "boolean" }, "parameters": { "type": "object" } } } },
    "states": { "type": "object", "minProperties": 1, "propertyNames": { "enum": ["normal", "pressed", "disabled", "selected", "locked", "highlighted"] }, "additionalProperties": { "type": "object", "additionalProperties": false, "properties": { "layerOverrides": { "type": "object" }, "contentOffset": { "type": "object", "additionalProperties": false, "required": ["x", "y"], "properties": { "x": { "type": "number" }, "y": { "type": "number" } } } } } },
    "sizing": { "type": "object", "additionalProperties": false, "properties": { "mode": { "enum": ["fixed", "stretch", "nine-slice"] }, "minimum": { "type": "object", "additionalProperties": false, "required": ["width", "height"], "properties": { "width": { "type": "number", "exclusiveMinimum": 0 }, "height": { "type": "number", "exclusiveMinimum": 0 } } } } },
    "compatibility": { "type": "object", "additionalProperties": false, "required": ["minimumRendererVersion"], "properties": { "minimumRendererVersion": { "$ref": "#/$defs/semver" }, "migrationNote": { "type": "string", "maxLength": 500 } } }
  },
  "$defs": { "id": { "type": "string", "pattern": "^[a-z][a-z0-9-]{2,62}$" }, "semver": { "type": "string", "pattern": "^(0|[1-9][0-9]*)\\.(0|[1-9][0-9]*)\\.(0|[1-9][0-9]*)(-[0-9A-Za-z.-]+)?(\\+[0-9A-Za-z.-]+)?$" } }
}
